
[I 2024-03-27 18:05:21,248] A new study created in memory with name: no-name-2dbceb7c-09e7-441f-87fd-18f5bc6f26c8
[I 2024-03-27 18:06:13,204] Trial 2 finished with value: -1.4569459131240612 and parameters: {'n_layers': 1, 'n_units_l0': 29, 'activation': 'logistic'}. Best is trial 2 with value: -1.4569459131240612.
[I 2024-03-27 18:06:16,623] Trial 3 finished with value: -1.4688535212137357 and parameters: {'n_layers': 3, 'n_units_l0': 19, 'n_units_l1': 47, 'n_units_l2': 35, 'activation': 'relu'}. Best is trial 2 with value: -1.4569459131240612.
[I 2024-03-27 18:06:18,982] Trial 0 finished with value: -1.4725041959731278 and parameters: {'n_layers': 1, 'n_units_l0': 79, 'activation': 'logistic'}. Best is trial 2 with value: -1.4569459131240612.
[I 2024-03-27 18:06:18,990] Trial 4 finished with value: -1.559046446867164 and parameters: {'n_layers': 2, 'n_units_l0': 55, 'n_units_l1': 41, 'activation': 'relu'}. Best is trial 2 with value: -1.4569459131240612.
[I 2024-03-27 18:06:21,137] Trial 1 finished with value: -1.5172941810890572 and parameters: {'n_layers': 1, 'n_units_l0': 83, 'activation': 'relu'}. Best is trial 2 with value: -1.4569459131240612.
[W 2024-03-27 18:06:22,178] Param n_units_l2 unique value length is less than 2.
[W 2024-03-27 18:06:22,178] Param n_units_l2 unique value length is less than 2.
[W 2024-03-27 18:06:22,178] Param n_units_l2 unique value length is less than 2.
[W 2024-03-27 18:06:22,179] Param n_units_l2 unique value length is less than 2.
[W 2024-03-27 18:06:22,179] Param n_units_l2 unique value length is less than 2.
[W 2024-03-27 18:06:22,179] Param n_units_l2 unique value length is less than 2.
[W 2024-03-27 18:06:22,179] Param n_units_l2 unique value length is less than 2.
[W 2024-03-27 18:06:22,179] Param n_units_l2 unique value length is less than 2.
Finished